### ISSUE TITLE
proxy: use larger connection windows

### ISSUE THREAD

**Issue by olix0r** [runconduit/conduit#638]
gRPC services grow the connection window to be substantially larger than the default 64KB;

```
    9   0.000382 52473 11111 HTTP2 89 WINDOW_UPDATE          ::1 → ::1         
Frame 9: 89 bytes on wire (712 bits), 89 bytes captured (712 bits) on interface 0
Null/Loopback
Internet Protocol Version 6, Src: ::1, Dst: ::1
Transmission Control Protocol, Src Port: 52473, Dst Port: 11111, Seq: 34, Ack: 1, Len: 13
HyperText Transfer Protocol 2
    Stream: WINDOW_UPDATE, Stream ID: 0, Length 4
        Length: 4
        Type: WINDOW_UPDATE (8)
        Flags: 0x00
            0000 0000 = Unused: 0x00
        0... .... .... .... .... .... .... .... = Reserved: 0x0
        .000 0000 0000 0000 0000 0000 0000 0000 = Stream Identifier: 0
        0... .... .... .... .... .... .... .... = Reserved: 0x0
        .000 0000 0000 1110 1111 1111 1111 0001 = Window Size Increment: 983025

...

   12   0.000596 11111 52473 HTTP2 89 WINDOW_UPDATE          ::1 → ::1         
Frame 12: 89 bytes on wire (712 bits), 89 bytes captured (712 bits) on interface 0
Null/Loopback
Internet Protocol Version 6, Src: ::1, Dst: ::1
Transmission Control Protocol, Src Port: 11111, Dst Port: 52473, Seq: 10, Ack: 47, Len: 13
HyperText Transfer Protocol 2
    Stream: WINDOW_UPDATE, Stream ID: 0, Length 4
        Length: 4
        Type: WINDOW_UPDATE (8)
        Flags: 0x00
            0000 0000 = Unused: 0x00
        0... .... .... .... .... .... .... .... = Reserved: 0x0
        .000 0000 0000 0000 0000 0000 0000 0000 = Stream Identifier: 0
        0... .... .... .... .... .... .... .... = Reserved: 0x0
        .000 0000 0000 1110 1111 1111 1111 0001 = Window Size Increment: 983025
```

if the proxy does not use this larger window in its own connections, it limits the throughput of grpc applications, especially in full-mesh configurations.

in the short term, we should replicate grpc's behavior in the proxy. later, this policy should be controllable.

**Comment by olix0r** [comment]
we can use [`Connection::set_target_window_size`](https://docs.rs/h2/0.1.2/h2/server/struct.Connection.html#method.set_target_window_size) with a value of `1024 * 1024`

**Comment by olix0r** [comment]
https://github.com/tower-rs/tower-h2/pull/22

**Comment by olix0r** [comment]
https://github.com/carllerche/h2/pull/249

**Comment by briansmith** [comment]
There was lots of discussion of this in #641. In particular, we found that the go-grpc behavior described above is only in an old version of go-grpc; newer versions of go-grpc start with a 64k initial connection window size.
